{
  "protocol": "xi.exchange.v1",
  "message_id": "10000000-0000-4000-8000-000000000006",
  "request_id": "40000000-0000-4000-8000-000000000001",
  "session_id": "20000000-0000-4000-8000-000000000001",
  "sender": {"system": "forgecore", "instance": "reference-b"},
  "recipient": {"system": "super-phi-vessel", "instance": "reference-a"},
  "type": "tool.result",
  "created_at": "2026-09-13T23:55:05Z",
  "payload": {
    "operation": "artifact.sha256",
    "status": "completed",
    "output": {
      "sha256": "231f6819dd40525827715ee0b893c1273b745a83a1f45a620c5aa6db40ddf4bb"
    },
    "receipt": {
      "request_id": "40000000-0000-4000-8000-000000000001",
      "operation": "artifact.sha256",
      "status": "completed",
      "receiver": "forgecore/reference-b",
      "recorded_at": "2026-09-13T23:55:05Z",
      "execution_count": 1,
      "artifact_sha256": "231f6819dd40525827715ee0b893c1273b745a83a1f45a620c5aa6db40ddf4bb"
    }
  }
}
