{
  "protocol": "xi.exchange.v1",
  "message_id": "10000000-0000-4000-8000-000000000001",
  "session_id": "20000000-0000-4000-8000-000000000001",
  "sender": {"system": "super-phi-vessel", "instance": "reference-a"},
  "recipient": {"system": "forgecore", "instance": "reference-b"},
  "type": "hello",
  "created_at": "2026-09-13T23:55:00Z",
  "payload": {
    "protocols": ["xi.exchange.v1"],
    "intent": "read_only_interop_test"
  }
}
